{
  "$schema": "https://json-schema.org/draft/2020-12/schema",
  "title": "Claim-Locked Public Release Bundle",
  "type": "object",
  "additionalProperties": false,
  "required": [
    "bundle_id",
    "version",
    "generated_at",
    "status",
    "purpose",
    "release_scope",
    "approved_release_statement",
    "ranking_rows",
    "release_artifacts",
    "blocked_claims",
    "publication_checks",
    "scan_paths",
    "quality_gate",
    "safety_assertions",
    "source_paths"
  ],
  "properties": {
    "bundle_id": {
      "type": "string",
      "const": "m87_claim_locked_public_release_bundle"
    },
    "version": {
      "type": "string",
      "minLength": 1
    },
    "generated_at": {
      "type": "string",
      "pattern": "^\\d{4}-\\d{2}-\\d{2}T\\d{2}:\\d{2}:\\d{2}Z$"
    },
    "status": {
      "type": "string",
      "enum": [
        "public_safe_release_bundle"
      ]
    },
    "purpose": {
      "type": "string",
      "minLength": 1
    },
    "release_scope": {
      "type": "object",
      "additionalProperties": false,
      "required": [
        "release_label",
        "allowed_claim_id",
        "source_checklist_path",
        "source_report_path",
        "evidence_class",
        "case_set_id",
        "case_set_version",
        "split",
        "release_allowed",
        "ranking_claim_allowed"
      ],
      "properties": {
        "release_label": {
          "type": "string",
          "const": "public_safe_local_open_weight_ranking"
        },
        "allowed_claim_id": {
          "type": "string",
          "const": "local_open_weight_ranking"
        },
        "source_checklist_path": {
          "type": "string",
          "const": "traces/external/claim_review_checklist.example.json"
        },
        "source_report_path": {
          "type": "string",
          "const": "reports/comparisons/local_open_weight_benchmark_v1.json"
        },
        "evidence_class": {
          "type": "string",
          "const": "local_public_benchmark"
        },
        "case_set_id": {
          "type": "string",
          "const": "local_public_v1"
        },
        "case_set_version": {
          "type": "string",
          "const": "1.0.0"
        },
        "split": {
          "type": "string",
          "const": "standard_or_extended"
        },
        "release_allowed": {
          "type": "boolean"
        },
        "ranking_claim_allowed": {
          "type": "boolean"
        }
      }
    },
    "approved_release_statement": {
      "type": "object",
      "additionalProperties": false,
      "required": [
        "headline",
        "summary",
        "required_qualifier"
      ],
      "properties": {
        "headline": {
          "type": "string",
          "minLength": 1
        },
        "summary": {
          "type": "string",
          "minLength": 1
        },
        "required_qualifier": {
          "type": "string",
          "minLength": 1
        }
      }
    },
    "ranking_rows": {
      "type": "array",
      "minItems": 1,
      "items": {
        "type": "object",
        "additionalProperties": false,
        "required": [
          "rank",
          "model",
          "runtime",
          "weighted_effective",
          "ci_95",
          "sample_size"
        ],
        "properties": {
          "rank": {
            "type": "integer",
            "minimum": 1
          },
          "model": {
            "type": "string",
            "minLength": 1
          },
          "runtime": {
            "type": "string",
            "const": "ollama"
          },
          "weighted_effective": {
            "type": "number",
            "minimum": 0,
            "maximum": 1
          },
          "ci_95": {
            "type": "string",
            "minLength": 1
          },
          "sample_size": {
            "type": "integer",
            "minimum": 1
          }
        }
      }
    },
    "release_artifacts": {
      "type": "array",
      "minItems": 1,
      "items": {
        "type": "object",
        "additionalProperties": false,
        "required": [
          "artifact_id",
          "path",
          "role",
          "public_safe",
          "required_for_release"
        ],
        "properties": {
          "artifact_id": {
            "type": "string",
            "minLength": 1
          },
          "path": {
            "type": "string",
            "minLength": 1
          },
          "role": {
            "type": "string",
            "enum": [
              "published_report",
              "claim_gate",
              "reproducibility_packet",
              "runtime_stability_profile",
              "runbook",
              "roadmap",
              "release_notes",
              "release_bundle"
            ]
          },
          "public_safe": {
            "type": "boolean"
          },
          "required_for_release": {
            "type": "boolean"
          }
        }
      }
    },
    "blocked_claims": {
      "type": "array",
      "minItems": 1,
      "items": {
        "type": "object",
        "additionalProperties": false,
        "required": [
          "claim_id",
          "blocker_id",
          "release_instruction",
          "required_unlock"
        ],
        "properties": {
          "claim_id": {
            "type": "string",
            "minLength": 1
          },
          "blocker_id": {
            "type": "string",
            "minLength": 1
          },
          "release_instruction": {
            "type": "string",
            "minLength": 1
          },
          "required_unlock": {
            "type": "string",
            "minLength": 1
          }
        }
      }
    },
    "publication_checks": {
      "type": "array",
      "minItems": 1,
      "items": {
        "type": "object",
        "additionalProperties": false,
        "required": [
          "check_id",
          "status",
          "evidence",
          "notes"
        ],
        "properties": {
          "check_id": {
            "type": "string",
            "minLength": 1
          },
          "status": {
            "type": "string",
            "enum": [
              "pass",
              "blocked"
            ]
          },
          "evidence": {
            "type": "string",
            "minLength": 1
          },
          "notes": {
            "type": "string",
            "minLength": 1
          }
        }
      }
    },
    "scan_paths": {
      "type": "array",
      "minItems": 1,
      "items": {
        "type": "string",
        "minLength": 1
      }
    },
    "quality_gate": {
      "type": "object",
      "additionalProperties": false,
      "required": [
        "bundle_validation_in_quality_gate",
        "live_local_execution_in_quality_gate",
        "runtime_probe_in_quality_gate",
        "raw_output_read_in_quality_gate",
        "provider_calls_in_quality_gate",
        "hosted_provider_submission_in_quality_gate",
        "private_evidence_read_in_quality_gate",
        "external_actions_in_quality_gate"
      ],
      "properties": {
        "bundle_validation_in_quality_gate": {
          "type": "boolean"
        },
        "live_local_execution_in_quality_gate": {
          "type": "boolean"
        },
        "runtime_probe_in_quality_gate": {
          "type": "boolean"
        },
        "raw_output_read_in_quality_gate": {
          "type": "boolean"
        },
        "provider_calls_in_quality_gate": {
          "type": "boolean"
        },
        "hosted_provider_submission_in_quality_gate": {
          "type": "boolean"
        },
        "private_evidence_read_in_quality_gate": {
          "type": "boolean"
        },
        "external_actions_in_quality_gate": {
          "type": "boolean"
        }
      }
    },
    "safety_assertions": {
      "type": "object",
      "additionalProperties": false,
      "required": [
        "public_safe",
        "metadata_only",
        "contains_private_data",
        "contains_raw_outputs",
        "contains_credentials_or_secrets",
        "live_execution",
        "provider_calls",
        "cloud_ranking_claim",
        "production_safety_claim",
        "hosted_provider_comparison_claim",
        "third_party_reproducibility_claim",
        "private_audit_claim",
        "unsupported_claims_released"
      ],
      "properties": {
        "public_safe": {
          "type": "boolean"
        },
        "metadata_only": {
          "type": "boolean"
        },
        "contains_private_data": {
          "type": "boolean"
        },
        "contains_raw_outputs": {
          "type": "boolean"
        },
        "contains_credentials_or_secrets": {
          "type": "boolean"
        },
        "live_execution": {
          "type": "boolean"
        },
        "provider_calls": {
          "type": "boolean"
        },
        "cloud_ranking_claim": {
          "type": "boolean"
        },
        "production_safety_claim": {
          "type": "boolean"
        },
        "hosted_provider_comparison_claim": {
          "type": "boolean"
        },
        "third_party_reproducibility_claim": {
          "type": "boolean"
        },
        "private_audit_claim": {
          "type": "boolean"
        },
        "unsupported_claims_released": {
          "type": "boolean"
        }
      }
    },
    "source_paths": {
      "type": "array",
      "minItems": 1,
      "items": {
        "type": "string",
        "minLength": 1
      }
    }
  }
}
